Date,Topic_CID,Sitting_CID,Order,Title,Subtitle,Section_Type,Question_Count
2014-07-07,012-002-092-007-001,012-002-092-007,1,President's Address,Speaker's Announcement for Address of Thanks,OS,
2014-07-07,012-002-092-007-002,012-002-092-007,2,New Bus Contracting Model,,OA,
2014-07-07,012-002-092-007-003,012-002-092-007,3,Business Model for Government Projects,Similarities to new bus contracting model,OA,
2014-07-07,012-002-092-007-004,012-002-092-007,4,Breach of SingPass User Accounts,,OA,
2014-07-07,012-002-092-007-005,012-002-092-007,5,Impact of Personal Data Protection Act on Financial Institutions' Contractual Relationship with Clients,,OA,
2014-07-07,012-002-092-007-006,012-002-092-007,6,Protection of Students against Sexual Predators,,OA,
2014-07-07,012-002-092-007-007,012-002-092-007,7,Clarification by Minister for Communications and Information ,,OS,
2014-07-07,012-002-092-007-008,012-002-092-007,8,Students' Participation in Co-curricular Activities,,OA,
2014-07-07,012-002-092-007-009,012-002-092-007,9,Repayment of Additional Housing Grant when Couples Break Up ,,OA,
2014-07-07,012-002-092-007-010,012-002-092-007,10,Easing Qualifying Criteria for Neighbourhood Renewal Programme,,OA,
2014-07-07,012-002-092-007-011,012-002-092-007,11,Participation Rate of Permanent Residents' Children in National Service ,,OA,
2014-07-07,012-002-092-007-012,012-002-092-007,12,Take-up Rate and Profile of Beneficiaries of Child Development Co-savings Scheme,,OA,
2014-07-07,012-002-092-007-013,012-002-092-007,13,Legal Framework for E-commerce and Online Sale Transactions,,OA,
2014-07-07,012-002-092-007-014,012-002-092-007,14,Illegal Hawking,,OA,
2014-07-07,012-002-092-007-015,012-002-092-007,15,Impact of Weather Patterns on Return of Transboundary Haze,,OA,
2014-07-07,012-002-092-007-016,012-002-092-007,16,Effect of New Licensed Moneylenders Rules on Consumers' Access to Credit,,OA,
2014-07-07,012-002-092-007-017,012-002-092-007,17,Loans Disbursed by Pawnshops,,OA,
2014-07-07,012-002-092-007-018,012-002-092-007,18,Changes in Processes to Prevent Misuse of Discarded Ballot Boxes,,OA,
2014-07-07,012-002-092-007-019,012-002-092-007,19,Funds from Dormant Accounts for Charity,,OA,
2014-07-07,012-002-092-007-020,012-002-092-007,20,Prices of Medicines Sold at Public Hospitals,Comparison of Singapore's medicine prices with those in neighbouring countries,OA,
2014-07-07,012-002-092-007-021,012-002-092-007,21,Factors Considered in Means-testing for Community Health Assist Scheme,,OA,
2014-07-07,012-002-092-007-022,012-002-092-007,22,National Database on Commercial Rents,,OA,
2014-07-07,012-002-092-007-023,012-002-092-007,23,Government's Response to the Report of the Committee of Inquiry into the 8 December 2013 Little India Riot ,,OS,
2014-07-07,012-002-092-007-024,012-002-092-007,24,Transboundary Haze Pollution Bill,,BI,
2014-07-07,012-002-092-007-025,012-002-092-007,25,Attorney-General (Additional Functions) Bill,,BI,
2014-07-07,012-002-092-007-026,012-002-092-007,26,Land Acquisition (Amendment) Bill,,BI,
2014-07-07,012-002-092-007-027,012-002-092-007,27,Radiation Protection (Amendment) Bill,,BP,
2014-07-07,012-002-092-007-028,012-002-092-007,28,"Corruption, Drug Trafficking and Other Serious Crimes (Confiscation of Benefits) (Amendment) Bill",,BP,
2014-07-07,012-002-092-007-029,012-002-092-007,29,Extension of a Sitting,In Parliament,OS,
2014-07-07,012-002-092-007-030,012-002-092-007,30,Copyright (Amendment) Bill,,BP,
2014-07-07,012-002-092-007-031,012-002-092-007,31,Adjournment of Debate,,OS,
2014-07-07,012-002-092-007-032,012-002-092-007,32,Adjournment,,OS,
2014-07-07,012-002-092-007-033,012-002-092-007,33,Singapore's Ranking in Trafficking in Persons Report,,WANA,
2014-07-07,012-002-092-007-034,012-002-092-007,34,Freelance Instructors Offering Co-curricular Activities in Schools (Impact of move to register such instructors),,WANA,
2014-07-07,012-002-092-007-035,012-002-092-007,35,Take-up Rates for Silver Housing Bonus and Lease Buyback Scheme,,WANA,
2014-07-07,012-002-092-007-036,012-002-092-007,36,Compulsory Modules in Collaborative Programmes between Local and Overseas Universities,,WANA,
2014-07-07,012-002-092-007-037,012-002-092-007,37,Impact of Personal Data Protection Act on Information Released by ACRA,,WANA,
2014-07-07,012-002-092-007-038,012-002-092-007,38,Review of ASEAN Charter,,WANA,
2014-07-07,012-002-092-007-039,012-002-092-007,39,Home Team Officers Offered Re-employment after Retirement,,WANA,
2014-07-07,012-002-092-007-040,012-002-092-007,40,Mandatory Coaching Workshops for Instructors who Train Students in Schools,,WANA,
2014-07-07,012-002-092-007-041,012-002-092-007,41,Use of Town Councils' Sinking Fund for Commercial Properties,,WANA,
2014-07-07,012-002-092-007-042,012-002-092-007,42,Disciplinary Action for Anti-social Acts in HDB Estates,,WANA,
2014-07-07,012-002-092-007-043,012-002-092-007,43,Offenders Booked under Extended Smoking Ban,,WANA,
2014-07-07,012-002-092-007-044,012-002-092-007,44,Investment Risks in Foreign Property Purchases,Government's efforts to highlight such risks,WANA,
2014-07-07,012-002-092-007-045,012-002-092-007,45,Ratifying With Reservations Major Human Rights Treaties and Conventions,,WANA,
2014-07-07,012-002-092-007-046,012-002-092-007,46,Government Facilitating Dialogue among Citizens with Widely Divergent Views,,WANA,
2014-07-07,012-002-092-007-047,012-002-092-007,47,Payment and Protection of Freelancers in Film and Television Industry,,WANA,
2014-07-07,012-002-092-007-048,012-002-092-007,48,Currency Denominations Dispensed at ATMs,,WA,
2014-07-07,012-002-092-007-049,012-002-092-007,49,"Full-time National Servicemen, NSmen and Regulars in the Singapore Police Force and Singapore Civil Defence Force",Breakdown by race and rank,WA,
2014-07-07,012-002-092-007-050,012-002-092-007,50,Government Agency to Protect Companies from Fake Organisations,,WA,
2014-07-07,012-002-092-007-051,012-002-092-007,51,Statistics on Executive Condominiums,,WA,
2014-07-07,012-002-092-007-052,012-002-092-007,52,Additional Levies on Unsold Non-landed Housing Units,,WA,
2014-07-07,012-002-092-007-053,012-002-092-007,53,Recent Lifting of Restrictions on Food Imports from Fukushima,,WA,
2014-07-07,012-002-092-007-054,012-002-092-007,54,"Breakdown of Full-time National Servicemen, Regulars and NSmen in the Singapore Armed Forces by Race, Vocation and Rank",,WA,
2014-07-07,012-002-092-007-055,012-002-092-007,55,Upgrading of Bukit Timah Canal and Maple Avenue Tributary Canal,,WA,
2014-07-07,012-002-092-007-056,012-002-092-007,56,Frequency of Mosquito-breeding Inspections at Unoccupied Private Properties,,WA,
2014-07-07,012-002-092-007-057,012-002-092-007,57,Asia-Middle East Dialogue Update,,WA,
2014-07-07,012-002-092-007-058,012-002-092-007,58,Operation of Community Hospitals by Cooperatives,,WA,
2014-07-07,012-002-092-007-059,012-002-092-007,59,Statistics on Hip Replacement and Knee Cap Surgery at Government Hospitals,,WA,
2014-07-07,012-002-092-007-060,012-002-092-007,60,Interim Care-giver Service Update,,WA,
2014-07-07,012-002-092-007-061,012-002-092-007,61,Claims from Medisave for Overseas Elective Treatments,,WA,
2014-07-07,012-002-092-007-062,012-002-092-007,62,Pre-employment Grants Awarded to Medical and Dental Students,,WA,
2014-07-07,012-002-092-007-063,012-002-092-007,63,"Construction Progress of King Albert Park, Sixth Avenue and Tan Kah Kee Downtown Line 2 Stations",,WA,
2014-07-07,012-002-092-007-064,012-002-092-007,64,Rationale for Biennial Roadworthiness Inspections for Vehicles Three Years Old and Above,,WA,
2014-07-07,012-002-092-007-065,012-002-092-007,65,Apportionment of Costs between SMRT and LTA under Rail Asset Renewal Plan,,WA,
2014-07-07,012-002-092-007-066,012-002-092-007,66,Details of Rail Financing Model Proposed by SMRT,,WA,
2014-07-07,012-002-092-007-067,012-002-092-007,67,Curriculum for Primary and Secondary Pupils in Full-Day Schools,,WA,
2014-07-07,012-002-092-007-068,012-002-092-007,68,Median Salary of Graduate and Diploma Teachers in MOE Kindergartens and Primary Schools,,WA,
2014-07-07,012-002-092-007-069,012-002-092-007,69,Singaporean Children Eligible for Child Development Account (CDA),,WA,
2014-07-07,012-002-092-007-070,012-002-092-007,70,Accreditation Body for Small Businesses Run by Skilled Tradesman and Workmen,,WA,
2014-07-07,012-002-092-007-071,012-002-092-007,71,Use of Data Analytics as Predictive Tools for Commuter Transport Demand and Supply,,WA,
