Date,Sitting_CID,MP_Name,Attendance
2018-02-27,013-001-094-061,Mr SPEAKER (Mr Tan Chuan-Jin (Marine Parade)).,True
2018-02-27,013-001-094-061,"Mr Amrin Amin (Sembawang), Parliamentary Secretary to the Minister for Health and Home Affairs.",True
2018-02-27,013-001-094-061,Mr Ang Hin Kee (Ang Mo Kio).,True
2018-02-27,013-001-094-061,Mr Ang Wei Neng (Jurong).,True
2018-02-27,013-001-094-061,Mr Azmoon Ahmad (Nominated Member).,True
2018-02-27,013-001-094-061,"Mr Baey Yam Keng (Tampines), Parliamentary Secretary to the Minister for Culture, Community and Youth.",True
2018-02-27,013-001-094-061,"Mr Chan Chun Sing (Tanjong Pagar), Minister, Prime Minister's Office and Government Whip.",True
2018-02-27,013-001-094-061,Miss Cheryl Chan Wei Ling (Fengshan).,True
2018-02-27,013-001-094-061,"Mr Chee Hong Tat (Bishan-Toa Payoh), Senior Minister of State for Communications and Information and Health.",True
2018-02-27,013-001-094-061,Mr Chen Show Mao (Aljunied).,True
2018-02-27,013-001-094-061,Miss Cheng Li Hui (Tampines).,True
2018-02-27,013-001-094-061,Dr Chia Shi-Lu (Tanjong Pagar).,True
2018-02-27,013-001-094-061,Ms Chia Yong Yong (Nominated Member).,True
2018-02-27,013-001-094-061,"Mr Charles Chong (Punggol East), Deputy Speaker.",True
2018-02-27,013-001-094-061,Mr Chong Kee Hiong (Bishan-Toa Payoh).,True
2018-02-27,013-001-094-061,Mr Desmond Choo (Tampines).,True
2018-02-27,013-001-094-061,Mr Thomas Chua Kee Seng (Nominated Member).,True
2018-02-27,013-001-094-061,Mr Darryl David (Ang Mo Kio).,True
2018-02-27,013-001-094-061,Mr Christopher de Souza (Holland-Bukit Timah).,True
2018-02-27,013-001-094-061,Assoc Prof Fatimah Lateef (Marine Parade).,True
2018-02-27,013-001-094-061,Mr Cedric Foo Chee Keng (Pioneer).,True
2018-02-27,013-001-094-061,Ms Foo Mee Har (West Coast).,True
2018-02-27,013-001-094-061,"Ms Grace Fu Hai Yien (Yuhua), Minister for Culture, Community and Youth and Leader of the House.",True
2018-02-27,013-001-094-061,"Mr Gan Kim Yong (Chua Chu Kang), Minister for Health.",True
2018-02-27,013-001-094-061,Mr Gan Thiam Poh (Ang Mo Kio).,True
2018-02-27,013-001-094-061,Mr Ganesh Rajaram (Nominated Member).,True
2018-02-27,013-001-094-061,Mr Goh Chok Tong (Marine Parade).,True
2018-02-27,013-001-094-061,Assoc Prof Daniel Goh Pei Siong (Non-Constituency Member).,True
2018-02-27,013-001-094-061,"Mr Heng Chee How (Jalan Besar), Senior Minister of State, Prime Minister's Office.",True
2018-02-27,013-001-094-061,"Mr Heng Swee Keat (Tampines), Minister for Finance.",True
2018-02-27,013-001-094-061,"Ms Indranee Rajah (Tanjong Pagar), Senior Minister of State for Finance and Law.",True
2018-02-27,013-001-094-061,Dr Intan Azura Mokhtar (Ang Mo Kio).,True
2018-02-27,013-001-094-061,"Mr S Iswaran (West Coast), Minister for Trade and Industry (Industry).",True
2018-02-27,013-001-094-061,"Dr Janil Puthucheary (Pasir Ris-Punggol), Senior Minister of State for Communications and Information and Education.",True
2018-02-27,013-001-094-061,"Mr Khaw Boon Wan (Sembawang), Coordinating Minister for Infrastructure and Minister for Transport.",True
2018-02-27,013-001-094-061,"Dr Amy Khor Lean Suan (Hong Kah North), Senior Minister of State for Health and the Environment and Water Resources.",True
2018-02-27,013-001-094-061,"Dr Koh Poh Koon (Ang Mo Kio), Senior Minister of State for National Development and Trade and Industry.",True
2018-02-27,013-001-094-061,Mr Kok Heng Leun (Nominated Member).,True
2018-02-27,013-001-094-061,Ms Kuik Shiao-Yin (Nominated Member).,True
2018-02-27,013-001-094-061,Mr Kwek Hian Chuan Henry (Nee Soon).,True
2018-02-27,013-001-094-061,"Dr Lam Pin Min (Sengkang West), Senior Minister of State for Health and Transport.",True
2018-02-27,013-001-094-061,Er Dr Lee Bee Wah (Nee Soon).,True
2018-02-27,013-001-094-061,"Mr Desmond Lee (Jurong), Minister for Social and Family Development, Second Minister for National Development and Deputy Leader of the House.",True
2018-02-27,013-001-094-061,"Mr Lee Hsien Loong (Ang Mo Kio), Prime Minister.",True
2018-02-27,013-001-094-061,Mr Lee Yi Shyan (East Coast).,True
2018-02-27,013-001-094-061,Mr Liang Eng Hwa (Holland-Bukit Timah).,True
2018-02-27,013-001-094-061,"Mr Lim Biow Chuan (Mountbatten), Deputy Speaker.",True
2018-02-27,013-001-094-061,"Mr Lim Hng Kiang (West Coast), Minister for Trade and Industry (Trade).",True
2018-02-27,013-001-094-061,"Mr Lim Swee Say (East Coast), Minister for Manpower.",True
2018-02-27,013-001-094-061,Ms Sylvia Lim (Aljunied).,True
2018-02-27,013-001-094-061,Dr Lim Wee Kiak (Sembawang).,True
2018-02-27,013-001-094-061,Mr Low Thia Khiang (Aljunied).,True
2018-02-27,013-001-094-061,"Ms Low Yen Ling (Chua Chu Kang), Senior Parliamentary Secretary to the Ministers for Trade and Industry and Education.",True
2018-02-27,013-001-094-061,Asst Prof Mahdev Mohan (Nominated Member).,True
2018-02-27,013-001-094-061,"Mr Masagos Zulkifli B M M (Tampines), Minister for the Environment and Water Resources.",True
2018-02-27,013-001-094-061,"Dr Mohamad Maliki Bin Osman (East Coast), Senior Minister of State for Defence and Foreign Affairs.",True
2018-02-27,013-001-094-061,Mr Muhamad Faisal Bin Abdul Manap (Aljunied).,True
2018-02-27,013-001-094-061,"Assoc Prof Dr Muhammad Faishal Ibrahim (Nee Soon), Senior Parliamentary Secretary to the Ministers for Education and Minister for Social and Family Development.",True
2018-02-27,013-001-094-061,Mr Murali Pillai (Bukit Batok).,True
2018-02-27,013-001-094-061,Dr Lily Neo (Jalan Besar).,True
2018-02-27,013-001-094-061,"Mr Ng Chee Meng (Pasir Ris-Punggol), Minister for Education (Schools) and Second Minister for Transport.",True
2018-02-27,013-001-094-061,"Dr Ng Eng Hen (Bishan-Toa Payoh), Minister for Defence.",True
2018-02-27,013-001-094-061,Mr Louis Ng Kok Kwang (Nee Soon).,True
2018-02-27,013-001-094-061,Mr Ong Teng Koon (Marsiling-Yew Tee).,True
2018-02-27,013-001-094-061,"Mr Ong Ye Kung (Sembawang), Minister for Education (Higher Education and Skills) and Second Minister for Defence.",True
2018-02-27,013-001-094-061,Ms Joan Pereira (Tanjong Pagar).,True
2018-02-27,013-001-094-061,Mr Leon Perera (Non-Constituency Member).,True
2018-02-27,013-001-094-061,Ms Denise Phua Lay Peng (Jalan Besar).,True
2018-02-27,013-001-094-061,Mr Png Eng Huat (Hougang).,True
2018-02-27,013-001-094-061,Mr Pritam Singh (Aljunied).,True
2018-02-27,013-001-094-061,Ms Rahayu Mahzam (Jurong).,True
2018-02-27,013-001-094-061,Mr Saktiandi Supaat (Bishan-Toa Payoh).,True
2018-02-27,013-001-094-061,Mr Seah Kian Peng (Marine Parade).,True
2018-02-27,013-001-094-061,"Mr K Shanmugam (Nee Soon), Minister for Home Affairs and Minister for Law.",True
2018-02-27,013-001-094-061,"Ms Sim Ann (Holland-Bukit Timah), Senior Minister of State for Culture, Community and Youth and Trade and Industry and Deputy Government Whip.",True
2018-02-27,013-001-094-061,Mr Sitoh Yih Pin (Potong Pasir).,True
2018-02-27,013-001-094-061,Ms Sun Xueling (Pasir Ris-Punggol).,True
2018-02-27,013-001-094-061,"Mr Sam Tan Chin Siong (Radin Mas), Minister of State, Prime Minister's Office and Minister of State for Foreign Affairs and Manpower and Deputy Government Whip.",True
2018-02-27,013-001-094-061,Mr Dennis Tan Lip Fong (Non-Constituency Member).,True
2018-02-27,013-001-094-061,Assoc Prof Randolph Tan (Nominated Member).,True
2018-02-27,013-001-094-061,Ms Jessica Tan Soon Neo (East Coast).,True
2018-02-27,013-001-094-061,Dr Tan Wu Meng (Jurong).,True
2018-02-27,013-001-094-061,Mr Patrick Tay Teck Guan (West Coast).,True
2018-02-27,013-001-094-061,"Mr Teo Chee Hean (Pasir Ris-Punggol), Deputy Prime Minister and Coordinating Minister for National Security.",True
2018-02-27,013-001-094-061,Dr Teo Ho Pin (Bukit Panjang).,True
2018-02-27,013-001-094-061,"Mrs Josephine Teo (Bishan-Toa Payoh), Minister, Prime Minister's Office and Second Minister for Home Affairs and Manpower.",True
2018-02-27,013-001-094-061,Mr Teo Ser Luck (Pasir Ris-Punggol).,True
2018-02-27,013-001-094-061,Ms K Thanaletchimi (Nominated Member).,True
2018-02-27,013-001-094-061,"Mr Tharman Shanmugaratnam (Jurong), Deputy Prime Minister and Coordinating Minister for Economic and Social Policies.",True
2018-02-27,013-001-094-061,Ms Tin Pei Ling (MacPherson).,True
2018-02-27,013-001-094-061,Mr Edwin Tong Chun Fai (Marine Parade).,True
2018-02-27,013-001-094-061,Mr Vikram Nair (Sembawang).,True
2018-02-27,013-001-094-061,"Dr Vivian Balakrishnan (Holland-Bukit Timah), Minister for Foreign Affairs.",True
2018-02-27,013-001-094-061,"Mr Lawrence Wong (Marsiling-Yew Tee), Minister for National Development and Second Minister for Finance.",True
2018-02-27,013-001-094-061,"Assoc Prof Dr Yaacob Ibrahim (Jalan Besar), Minister for Communications and Information and Minister-in-charge of Muslim Affairs.",True
2018-02-27,013-001-094-061,Mr Alex Yam (Marsiling-Yew Tee).,True
2018-02-27,013-001-094-061,Mr Yee Chia Hsing (Chua Chu Kang).,True
2018-02-27,013-001-094-061,Mr Melvin Yong Yik Chye (Tanjong Pagar).,True
2018-02-27,013-001-094-061,Mr Zainal Sapari (Pasir Ris-Punggol).,True
2018-02-27,013-001-094-061,Mr Zaqy Mohamad (Chua Chu Kang).,True
