Date,Topic_CID,Sitting_CID,Order,Title,Subtitle,Section_Type,Question_Count
2018-07-10,013-002-094-079-001,013-002-094-079,1,Number of Teachers Trained to Teach Special Needs Students,,OA,
2018-07-10,013-002-094-079-002,013-002-094-079,2,Measures to Mitigate Increasing Cost of Living,,OA,
2018-07-10,013-002-094-079-003,013-002-094-079,3,Ragging Culture in the SAF,,OA,
2018-07-10,013-002-094-079-004,013-002-094-079,4,Long-Term Investment Returns of Temasek Holdings and GIC,,OA,
2018-07-10,013-002-094-079-005,013-002-094-079,5,Rationale for Not Replacing ElderShield with CareShield Life,,OA,
2018-07-10,013-002-094-079-006,013-002-094-079,6,Industrial Fire Trends and Spot Checks to Ensure Compliance to Safety Measures,,OA,
2018-07-10,013-002-094-079-007,013-002-094-079,7,Profile of Victims of Internet Love Scams,,OA,
2018-07-10,013-002-094-079-008,013-002-094-079,8,Success Rate for Job Matching on MyCareersFuture.sg,,OA,
2018-07-10,013-002-094-079-009,013-002-094-079,9,Transport Safety Investigations Bill,,BI,
2018-07-10,013-002-094-079-010,013-002-094-079,10,CareShield Life,Motion,OS,
2018-07-10,013-002-094-079-011,013-002-094-079,11,Extension of a Sitting,In Parliament,OS,
2018-07-10,013-002-094-079-012,013-002-094-079,12,CareShield Life,,OS,
2018-07-10,013-002-094-079-013,013-002-094-079,13,Care Provisions in Welfare Homes and Support for Re-integration into Community,,WANA,
2018-07-10,013-002-094-079-014,013-002-094-079,14,Prevention of Power Outage in Central Business District,,WANA,
2018-07-10,013-002-094-079-015,013-002-094-079,15,Review of Regulations to Protect Wild Animals near Places such as Construction Sites,,WANA,
2018-07-10,013-002-094-079-016,013-002-094-079,16,Enforcement Action against Errant Users of Personal Mobility Devices ,,WANA,
2018-07-10,013-002-094-079-017,013-002-094-079,17,Proposal to Tighten Regulations for Users of Personal Mobility Devices,,WANA,
2018-07-10,013-002-094-079-018,013-002-094-079,18,Flexi Flats Returned to HDB after Demise of Owners,,WANA,
2018-07-10,013-002-094-079-019,013-002-094-079,19,Remedial Steps to Improve Workplace Safety by PIE Viaduct Collapse Contractor,,WANA,
2018-07-10,013-002-094-079-020,013-002-094-079,20,Evaluation of Public Construction Work Tenders after Incidence of PIE Viaduct Collapse,,WANA,
2018-07-10,013-002-094-079-021,013-002-094-079,21,"Proposal for MRT stations for along Cross Island Line at Fernvale, Sengkang, Hougang and Buangkok",,WANA,
2018-07-10,013-002-094-079-022,013-002-094-079,22,Ban of Smartphones in Schools,,WANA,
2018-07-10,013-002-094-079-023,013-002-094-079,23,Trend of Cord Blood Donation by Minority Races,,WANA,
2018-07-10,013-002-094-079-024,013-002-094-079,24,Action against Sale of Illegal and Sexual Enhancement Drugs at Junction of Aljunied Road and Geylang Road,,WANA,
2018-07-10,013-002-094-079-025,013-002-094-079,25,Number of Public Healthcare Workers Not Offered Re-employment,,WANA,
2018-07-10,013-002-094-079-026,013-002-094-079,26,Proposal to Review Specialist Training under Accreditation Council for Graduate Medical Education,,WANA,
2018-07-10,013-002-094-079-027,013-002-094-079,27,Adherence to National Wages Council Guidelines as Qualifying Criterion for Companies to be Eligible for Government Funding,,WANA,
2018-07-10,013-002-094-079-028,013-002-094-079,28,Support for Non-profit Organisations Promoting Lifelong Employability of Seniors,,WANA,
2018-07-10,013-002-094-079-029,013-002-094-079,29,Increasing Incidents of Fires Involving Personal Mobility Devices,,WANA,
2018-07-10,013-002-094-079-030,013-002-094-079,30,Allowing First-timers to Buy HDB BTO and New Flats without Income Ceiling,,WANA,
2018-07-10,013-002-094-079-031,013-002-094-079,31,Ability of HDB Flats to Withstand Decay and Strong Winds and Rain,,WANA,
2018-07-10,013-002-094-079-032,013-002-094-079,32,"Minimum Age for Users of Electric Bicycles, E-scooters and PMDs",,WANA,
2018-07-10,013-002-094-079-033,013-002-094-079,33,"Design PMD Rules to Keep Elderly, Younger and Disabled Pedestrians Safe",,WANA,
2018-07-10,013-002-094-079-034,013-002-094-079,34,Projects Undertaken by PIE Viaduct Collapse Contractor,,WANA,
2018-07-10,013-002-094-079-035,013-002-094-079,35,Top-up of EZ-link Cards at Passenger Service Centre of MRT Stations,,WANA,
2018-07-10,013-002-094-079-036,013-002-094-079,36,Recourse for Victims of Hit-and-run E-scooter Accidents,,WANA,
2018-07-10,013-002-094-079-037,013-002-094-079,37,Accuracy of National Service’s Physical Employment Standards System,,WANA,
2018-07-10,013-002-094-079-038,013-002-094-079,38,Breakdown of New Hires for Graduate Roles in Public Service and Civil Service from 2013 to 2017 ,,WA,
2018-07-10,013-002-094-079-039,013-002-094-079,39,Update on Current Status of Malaysia-Singapore High-Speed Rail Project,,WA,
2018-07-10,013-002-094-079-040,013-002-094-079,40,After-arrest Mental Healthcare Provided for Mental Illness Cases,,WA,
2018-07-10,013-002-094-079-041,013-002-094-079,41,New Citizens Relinquishing Their Citizenship in Past 20 Years,,WA,
2018-07-10,013-002-094-079-042,013-002-094-079,42,Standardisation of Starting Salary for MOH Scholars Across All Its Healthcare Clusters,,WA,
2018-07-10,013-002-094-079-043,013-002-094-079,43,Research Conducted on Awareness Level of Smoking-related Health Risks among Singaporeans,,WA,
2018-07-10,013-002-094-079-044,013-002-094-079,44,Free Live Broadcasts of World Cup 2018 in Singapore,,WA,
2018-07-10,013-002-094-079-045,013-002-094-079,45,Regulation to Ensure Deletion of Personal Data Collected by oBike,,WA,
2018-07-10,013-002-094-079-046,013-002-094-079,46,Statistics on Stamp Duty and Property Tax Collected from Purchase and Sale of Properties from 2015 to 2017,,WA,
2018-07-10,013-002-094-079-047,013-002-094-079,47,Breakdown on Disbursement of Agriculture Productivity Fund to Companies,,WA,
2018-07-10,013-002-094-079-048,013-002-094-079,48,Average Annual Electricity Consumption for Commercial Buildings from 2013 to 2017,,WA,
2018-07-10,013-002-094-079-049,013-002-094-079,49,Provisions for Candidates with Medical Certificate to Resit Primary School Leaving Examination,,WA,
2018-07-10,013-002-094-079-050,013-002-094-079,50,Tracking of Students Who Drop Out of Secondary Education,,WA,
2018-07-10,013-002-094-079-051,013-002-094-079,51,CPF Account Withdrawals and Cancellations by Singaporeans and Permanent Residents,,WA,
2018-07-10,013-002-094-079-052,013-002-094-079,52,Annual Breakdown on Approval of Foreign Manpower Request for Companies Not Meeting Minimum Salary or Quota Requirements,,WA,
