Date,Topic_CID,Sitting_CID,Order,Title,Subtitle,Section_Type,Question_Count
2019-05-06,013-002-094-103-001,013-002-094-103,1,University Students Involved in Voyeurism and Sexual Harassment Cases,,OA,
2019-05-06,013-002-094-103-002,013-002-094-103,2,Enhancing Measures to Prevent Sexual Harassment in Schools and Institutes of Higher Learning,,OA,
2019-05-06,013-002-094-103-003,013-002-094-103,3,Police’s Handling of Voyeurism Cases and Issuance of Conditional Warning,,OA,
2019-05-06,013-002-094-103-004,013-002-094-103,4,Effectiveness of Annual Casino Entry Fee Paid by Singaporeans and PRs in Preventing Problem Gambling ,,OA,
2019-05-06,013-002-094-103-005,013-002-094-103,5,Detection and Prevention of Casino-related Crimes,,OA,
2019-05-06,013-002-094-103-006,013-002-094-103,6,Effectiveness of Social Safeguards in Curbing Problem Gambling,,OA,
2019-05-06,013-002-094-103-007,013-002-094-103,7,Move to Allow Casino Operators’ to Increase their Approved Gaming Area ,,OA,
2019-05-06,013-002-094-103-008,013-002-094-103,8,Findings and Follow-up Actions on National Service Training Death,Statement by Minister for Defence,OS,
2019-05-06,013-002-094-103-009,013-002-094-103,9,Road Traffic (Amendment) Bill,,BI,
2019-05-06,013-002-094-103-010,013-002-094-103,10,Pioneer Generation Fund (Amendment) Bill ,,BP,
2019-05-06,013-002-094-103-011,013-002-094-103,11,Criminal Law Reform Bill ,,BP,
2019-05-06,013-002-094-103-012,013-002-094-103,12,Exempted Business ,Business Motion,OS,
2019-05-06,013-002-094-103-013,013-002-094-103,13,Criminal Law Reform Bill,,BP,
2019-05-06,013-002-094-103-014,013-002-094-103,14,Adjournment,,OS,
2019-05-06,013-002-094-103-015,013-002-094-103,15,Impact on Singapore of Prolonged Stoppage of Water Treatment at Johor Plant,,WANA,
2019-05-06,013-002-094-103-016,013-002-094-103,16,Preventive Measures at Hospitals in light of Emergence of Drug-resistant Superbugs,,WANA,
2019-05-06,013-002-094-103-017,013-002-094-103,17,Average CPF Balance of Persons in Different Income Groups and Proposal to Offer Differentiated CPF Interest Rates,,WANA,
2019-05-06,013-002-094-103-018,013-002-094-103,18,Appeals by Persons who have Obtained BTO Flats more than Twice in Five Years,,WANA,
2019-05-06,013-002-094-103-019,013-002-094-103,19,Government's Stand on Developers Offering Two-year Deferment Schemes to Home Buyers,,WANA,
2019-05-06,013-002-094-103-020,013-002-094-103,20,Processing Time for Make-up Pay for In-camp Training,,WANA,
2019-05-06,013-002-094-103-021,013-002-094-103,21,Workplace Accidents in Schools Involving Cleaners,,WANA,
2019-05-06,013-002-094-103-022,013-002-094-103,22,Police Reports Filed against PMD Users,,WANA,
2019-05-06,013-002-094-103-023,013-002-094-103,23,Singaporeans or PRs Involved in Easter Sunday Bombings in Sri Lanka,,WANA,
2019-05-06,013-002-094-103-024,013-002-094-103,24,Road Accidents Involving Pedestrians Using Mobile Phones,,WANA,
2019-05-06,013-002-094-103-025,013-002-094-103,25,Payment for A&E Services in Public Hospitals,,WANA,
2019-05-06,013-002-094-103-026,013-002-094-103,26,Ensuring Uber's Employment Practices are In Line with Singapore's Tripartite Standards,,WANA,
2019-05-06,013-002-094-103-027,013-002-094-103,27,Complaints from Owners of DBSS Flats about Recurrent Defects or Discoloured Floorings,,WANA,
2019-05-06,013-002-094-103-028,013-002-094-103,28,Proportion of Children in Cohort Whose Parents Maximise Co-matching Amount for CDA,,WANA,
2019-05-06,013-002-094-103-029,013-002-094-103,29,Number of and Time Taken to Clear Vehicles that Break Down on the Roads,,WANA,
2019-05-06,013-002-094-103-030,013-002-094-103,30,LCD Displays at MRT Platforms to Indicate Time Remaining before Train Doors Close,,WANA,
2019-05-06,013-002-094-103-031,013-002-094-103,31,Number of People Using Medisave to Pay for Parents' Healthcare Bills,,WANA,
2019-05-06,013-002-094-103-032,013-002-094-103,32,Cases of Suspected Unauthorised Subletting of HDB Flats,,WANA,
2019-05-06,013-002-094-103-033,013-002-094-103,33,Disallowing Cyclists on Bus Lanes during Bus Lane Operating Hours,,WANA,
2019-05-06,013-002-094-103-034,013-002-094-103,34,Impact of Instrument Landing System Withdrawal at Seletar Airport,,WANA,
2019-05-06,013-002-094-103-035,013-002-094-103,35,ACRA’s Oversight of Auditors whose Audit Opinions of Listed Companies Found Wanting,,WANA,
2019-05-06,013-002-094-103-036,013-002-094-103,36,Quality of Training at Overseas Medical Schools Dropped from Approved List,,WANA,
2019-05-06,013-002-094-103-037,013-002-094-103,37,Complaints to Council of Estate Agencies about Property Agents,,WANA,
2019-05-06,013-002-094-103-038,013-002-094-103,38,Proposal for Anti-scalping Legislation in Singapore to Keep in Check Black Market for Concert Tickets,,WANA,
2019-05-06,013-002-094-103-039,013-002-094-103,39,Public Agencies’ Exemption from Personal Data Protection Act,,WA,
2019-05-06,013-002-094-103-040,013-002-094-103,40,Steps to Ensure Thales Signalling System is Safe for Use on MRT System,,WA,
2019-05-06,013-002-094-103-041,013-002-094-103,41,Review of Speed Limit on Non-Expressway Roads,,WA,
2019-05-06,013-002-094-103-042,013-002-094-103,42,Breakdown of Taxi Drivers and Private Hire Drivers by Age Group,,WA,
2019-05-06,013-002-094-103-043,013-002-094-103,43,Traffic Recovery Procedures and Response Time,,WA,
2019-05-06,013-002-094-103-044,013-002-094-103,44,Role of Government in Export Sales of Weapons and Ammunition by Singapore Technologies Land Systems,,WA,
2019-05-06,013-002-094-103-045,013-002-094-103,45,Human Trafficking Syndicate within ASEAN Targeting Rohingya People,,WA,
2019-05-06,013-002-094-103-046,013-002-094-103,46,Update and Review on Liquor Control Act,,WA,
2019-05-06,013-002-094-103-047,013-002-094-103,47,Number of Kitchen Exhaust Duct Fires from 2014 to 2018 and Measures to Minimise Risk of Such Incidents,,WA,
2019-05-06,013-002-094-103-048,013-002-094-103,48,Average Waiting Time for Seniors to Access Care Services,,WA,
2019-05-06,013-002-094-103-049,013-002-094-103,49,Number of Seniors Benefiting from Home-based Care Services from 2016 to 2018,,WA,
2019-05-06,013-002-094-103-050,013-002-094-103,50,"Breakdown of Singaporeans Utilising Nursing Homes, Home Care, Day Care and Respite Care Services",,WA,
2019-05-06,013-002-094-103-051,013-002-094-103,51,Profile of Healthcare Workers Providing Long-term Care Services and Their Skill and Manpower Gaps,,WA,
2019-05-06,013-002-094-103-052,013-002-094-103,52,"Percentage of Spending on Mental Health, Diabetes and Ageing versus Total Healthcare Spending in 2018 against Amount Budgeted for 2019",,WA,
2019-05-06,013-002-094-103-053,013-002-094-103,53,Remedial Actions Following High Blood Pressure Drug Recall,,WA,
2019-05-06,013-002-094-103-054,013-002-094-103,54,"Government Support for Diagnosis, Treatment and Subsidy for Persons with Rare Diseases in Singapore",,WA,
2019-05-06,013-002-094-103-055,013-002-094-103,55,Poor Customer and Helpdesk Service by Singapore Telcos,,WA,
2019-05-06,013-002-094-103-056,013-002-094-103,56,Recall of Fisher-Price Baby Rocker in US,,WA,
2019-05-06,013-002-094-103-057,013-002-094-103,57,Competition from China's Plan for Greater Bay Area Project,,WA,
2019-05-06,013-002-094-103-058,013-002-094-103,58,Trees Uprooted and Fallen in Public Spaces Last Year,,WA,
2019-05-06,013-002-094-103-059,013-002-094-103,59,HDB BTO Applicants Who Obtained Housing Grants,,WA,
2019-05-06,013-002-094-103-060,013-002-094-103,60,Transfer of Flats under 2-room Flexi Scheme for Seniors,,WA,
2019-05-06,013-002-094-103-061,013-002-094-103,61,"Illegal Wildlife Trade Consignments Detected at Singapore’s Land, Air and Sea Checkpoints",,WA,
2019-05-06,013-002-094-103-062,013-002-094-103,62,Increase in Mass Food Poisoning Cases,,WA,
2019-05-06,013-002-094-103-063,013-002-094-103,63,More Support for Environmentally Sustainable Projects,,WA,
2019-05-06,013-002-094-103-064,013-002-094-103,64,Public Education Programmes on Vaccines,,WA,
2019-05-06,013-002-094-103-065,013-002-094-103,65,Current Demand for Higher Chinese at Primary 1,,WA,
2019-05-06,013-002-094-103-066,013-002-094-103,66,Unpaid Salaries Owed to Foreign Employees,,WA,
2019-05-06,013-002-094-103-067,013-002-094-103,67,Study on Gender Pay Gap,,WA,
2019-05-06,013-002-094-103-068,013-002-094-103,68,"Citizens Earning Less Than $1,300 and $2,000 Per Month from Full-time Work",,WA,
2019-05-06,013-002-094-103-069,013-002-094-103,69,Medical Insurance Coverage for Foreign Domestic Workers,,WA,
2019-05-06,013-002-094-103-070,013-002-094-103,70,Applications for ComCare Child Care Subsidy,,WA,
2019-05-06,013-002-094-103-071,013-002-094-103,71,Regulation of Student Care Centres,,WA,
2019-05-06,013-002-094-103-072,013-002-094-103,72,Paternity Leave Taken in Each of Past Five Years,,WA,
