Date,Topic_CID,Sitting_CID,Order,Title,Subtitle,Section_Type,Question_Count
2020-02-27,013-002-094-120-001,013-002-094-120,1,Time Allocation for Committee of Supply,Announcement by Mr Speaker,OS,
2020-02-27,013-002-094-120-002,013-002-094-120,2,Exempt Taxi Drivers who have Taken Medical Assessments for Personal Licence from Retaking Same Tests for Vocational Licence within Same Year,,OA,
2020-02-27,013-002-094-120-003,013-002-094-120,3,Prevalence of and Enforcement against Jaywalking,,OA,
2020-02-27,013-002-094-120-004,013-002-094-120,4,Extending Mandatory Time-frame for When Government-Paid Paternity Leave can be Consumed to 24 Months,,OA,
2020-02-27,013-002-094-120-005,013-002-094-120,5,Debate on Annual Budget Statement,,OS,
2020-02-27,013-002-094-120-006,013-002-094-120,6,Adjournment of Debate,,OS,
2020-02-27,013-002-094-120-007,013-002-094-120,7,Adjournment,,OS,
2020-02-27,013-002-094-120-008,013-002-094-120,8,"Data on Number of Registered Electric Cars, Hybrid Car and Petrol Car in Past Three Years",,WA,
2020-02-27,013-002-094-120-009,013-002-094-120,9,Number of Cars Registered under Vehicle Emission Schemes from January 2018,,WA,
