Date,Topic_CID,Sitting_CID,Order,Title,Subtitle,Section_Type,Question_Count
2021-11-03,014-001-095-043-001,014-001-095-043,1,Announcement by Speaker,Members in Committee of Privileges,OS,
2021-11-03,014-001-095-043-002,014-001-095-043,2,Investigations into Whether Singapore-based Individuals or Financial Institutions were Implicated in Pandora Papers Disclosures,,OA,
2021-11-03,014-001-095-043-003,014-001-095-043,3,Protection for Point-to-point Drivers when Ferrying Patients to and from PCR Test Venues,,OA,
2021-11-03,014-001-095-043-004,014-001-095-043,4,Near- and Medium-term Outlook for Inflation in Singapore and Steps to Mitigate Sharp Rise,,OA,
2021-11-03,014-001-095-043-005,014-001-095-043,5,Expected ComCare Assistance Payouts in FY2021,,OA,
2021-11-03,014-001-095-043-006,014-001-095-043,6,Continuity of School Financial Assistance when Students are Posted from One School to Another,,OA,
2021-11-03,014-001-095-043-007,014-001-095-043,7,Students' Low-cost Access to High-speed Internet Outside of School,,OA,
2021-11-03,014-001-095-043-008,014-001-095-043,8,"Take-up for Enhancement for Active Seniors Programme and Plans to Build Elderly-, Child- and Disabled-friendly Features in HDB Flats and Estates",,OA,
2021-11-03,014-001-095-043-009,014-001-095-043,9,Profile of Offenders and Fines Issued under Tray Return Campaign ,,OA,
2021-11-03,014-001-095-043-010,014-001-095-043,10,Business Closures due to COVID-19 Pressures and Support for Companies for Post-crisis Growth,,OA,
2021-11-03,014-001-095-043-011,014-001-095-043,11,Closure of Tourism-related and Retail Businesses and Efforts to Stimulate Growth In These Sectors,,OA,
2021-11-03,014-001-095-043-012,014-001-095-043,12,Impact of COVID-19 Work Arrangements on Sectoral Productivity Rates,,OA,
2021-11-03,014-001-095-043-013,014-001-095-043,13,Potential Disruptions to Manpower Resources in Sectors Such as Cleaning and Hospitality as Singapore Reopens under Vaccinated Travel Lanes,,OA,
2021-11-03,014-001-095-043-014,014-001-095-043,14,Impact of Artificial Intelligence Marking for English Subject Assignments on Students' Creativity and Writing Ability,,OA,
2021-11-03,014-001-095-043-015,014-001-095-043,15,Accidents and Violations Involving Heavy Vehicles,,OA,
2021-11-03,014-001-095-043-016,014-001-095-043,16,Government Borrowing (Miscellaneous Amendments) Bill,,BP,
2021-11-03,014-001-095-043-017,014-001-095-043,17,Constitution of the Republic of Singapore (Amendment) Bill  ,,BP,
2021-11-03,014-001-095-043-018,014-001-095-043,18,Judicial Service (Miscellaneous Amendments) Bill ,,BP,
2021-11-03,014-001-095-043-019,014-001-095-043,19,Adjournment,,OS,
2021-11-03,014-001-095-043-020,014-001-095-043,20,Role of Migrant Domestic Workers in Singapore's Caregiving Landscape,,OS,
2021-11-03,014-001-095-043-021,014-001-095-043,21,Closure of F&B Businesses due to COVID-19 Pandemic and Impact on Employees,,WANA,
2021-11-03,014-001-095-043-022,014-001-095-043,22,Support for Dementia Patients at High Risk of Deteriorating due to COVID-19-related Social Isolation,,WANA,
2021-11-03,014-001-095-043-023,014-001-095-043,23,Scams Resulting from Integration of Cross-border E-payment Services,,WANA,
2021-11-03,014-001-095-043-024,014-001-095-043,24,COVID-19 Vaccination Rates of Singaporean Students Studying Abroad and Efforts to Ensure Safety of Singapore Students Abroad,,WANA,
2021-11-03,014-001-095-043-025,014-001-095-043,25,Special Covenant 2(1)(a) of Memorandum of Lease to HDB's Lease Agreement to Prevent Smoking near Balconies or Windows,,WANA,
2021-11-03,014-001-095-043-026,014-001-095-043,26,Duration that Booster Jabs will Remain Free of Charge Given COVID-19 as Endemic Posture,,WANA,
2021-11-03,014-001-095-043-027,014-001-095-043,27,Safeguards to Prevent Serious Assault Case Involving Inmates at Changi Prison Complex,,WANA,
2021-11-03,014-001-095-043-028,014-001-095-043,28,Proposal to Review Social Assistance Payouts to Take into Account Debts of Those Retrenched Such As Renovation Loans and Insurance Payments,,WANA,
2021-11-03,014-001-095-043-029,014-001-095-043,29,Impact of Delayed Major Construction Projects on Singapore Economy,,WANA,
2021-11-03,014-001-095-043-030,014-001-095-043,30,Number of Construction Noise-related Complaints,,WANA,
2021-11-03,014-001-095-043-031,014-001-095-043,31,Travel Arrangements for Those Undergoing Assisted Reproductive Technology Procedures Overseas But Whose Travel Have Been Restricted due to COVID-19,,WANA,
2021-11-03,014-001-095-043-032,014-001-095-043,32,Review Restrictions to Facilitate Entry of Non-traditional Source Migrant Workers who Satisfy Necessary Health-related Entry Requirements,,WANA,
2021-11-03,014-001-095-043-033,014-001-095-043,33,Number of Days of Closure of and Dismissal Times at Primary Schools outside of Norms,,WANA,
2021-11-03,014-001-095-043-034,014-001-095-043,34,Indicators for Companies to Establish Mental Health Support System for Their Employees,,WANA,
2021-11-03,014-001-095-043-035,014-001-095-043,35,Work Injury Claims for Injuries Sustained while Working From Home,,WANA,
2021-11-03,014-001-095-043-036,014-001-095-043,36,Proportion of Students in Government-aided Schools who are Permanent Residents or International Students and with One Singaporean Parent,,WANA,
2021-11-03,014-001-095-043-037,014-001-095-043,37,Existing Communication Protocol on Informing Next-of-kin of Person who Died by Suicide,,WANA,
2021-11-03,014-001-095-043-038,014-001-095-043,38,Cases Investigated for Breaches of Consumer Protection (Fair Trading) Act in Past Five Years,,WANA,
2021-11-03,014-001-095-043-039,014-001-095-043,39,"Proportion of COVID-19 Re-infections from Cases in Local Community and in Dormitories, and Duration of Immunity following COVID-19 Infection",,WANA,
2021-11-03,014-001-095-043-040,014-001-095-043,40,Limits to Maximum Number of Migrant Domestic Worker per Household Given Impact of COVID-19 Restrictions on Entry of New Migrant Workers,,WANA,
2021-11-03,014-001-095-043-041,014-001-095-043,41,Data on Socio-economic and Ethnic Profiles of Secondary Students and Ensuring Socio-economic Diversity in Schools,,WANA,
2021-11-03,014-001-095-043-042,014-001-095-043,42,Consideration of Prior Work and Managerial Experience in Approval for Registration as Real Estate Salespersons,,WANA,
2021-11-03,014-001-095-043-043,014-001-095-043,43,Adequacy of Planned Increases in ICU and Medical Beds to Cope with Potential Surge in COVID-19 Cases and Mental Well-being of Healthcare Professionals,,WANA,
2021-11-03,014-001-095-043-044,014-001-095-043,44,Percentage of Household Members who Are Eventually Infected due to  COVID-19-positive Member's Isolation on Home Recovery Programme,,WANA,
2021-11-03,014-001-095-043-045,014-001-095-043,45,Resumption of Recreational Team Sports at Public and Private Sports Facilities with Pre-event Antigen Rapid Tests,,WANA,
2021-11-03,014-001-095-043-046,014-001-095-043,46,Proposal to Make COVID-19 Vaccination Mandatory to Relieve Pressure on Healthcare System,,WANA,
2021-11-03,014-001-095-043-047,014-001-095-043,47,Flexi-work and Work-from-home Arrangements in COVID-19 as Endemic Stage,,WANA,
2021-11-03,014-001-095-043-048,014-001-095-043,48,False Allegations of Employer Abuse Made by Migrant Domestic Workers and Applicable Penalties,,WANA,
2021-11-03,014-001-095-043-049,014-001-095-043,49,Australia-Asia Power Link to Supply 15% of Renewable Energy for Singapore,,WANA,
2021-11-03,014-001-095-043-050,014-001-095-043,50,Regulations to Monitor or Uncover Any Illicit Activities of Offshore Financial Service Providers with Offices Registered in Singapore in Light of Pandora Papers Leaks,,WA,
2021-11-03,014-001-095-043-051,014-001-095-043,51,Usage of Data Captured from Deployment of Surveillance Technologies for Crime Prevention and Addressing Concerns of Those Who Feel Their Privacy Is Invaded,,WA,
2021-11-03,014-001-095-043-052,014-001-095-043,52,Impact to Food Prices in Next Six Months Given Supply Chain Disruption and Increase in Energy Costs,,WA,
2021-11-03,014-001-095-043-053,014-001-095-043,53,Number of Cyclists Booked for Riding on Right Side of Motor Vehicles in Past Five Years and Cyclists Riding on Right Side of Bus Lane,,WA,
2021-11-03,014-001-095-043-054,014-001-095-043,54,Value of Services Provided by Public Transport Operators in Return for Grants Given during COVID-19 Pandemic and Sustainability of Model,,WA,
2021-11-03,014-001-095-043-055,014-001-095-043,55,Average Licensing Cost Incurred by Non-hawker Food and Beverage Establishment and Plans to Waiver Costs for Licence Renewals for FY2022 Given Impact from COVID-19,,WA,
2021-11-03,014-001-095-043-056,014-001-095-043,56,Instances Necessitating Erection of Sound Barriers at Construction Sites in Past Two Years,,WA,
2021-11-03,014-001-095-043-057,014-001-095-043,57,Plans to Expand Project Wolbachia to Other Areas and Available Studies on Long-Term Ecological Impact Related to Release of Wolbachia-carrying Mosquitoes,,WA,
2021-11-03,014-001-095-043-058,014-001-095-043,58,Proposal to Make Changes to School Curriculum to Lessen Amount of Homework that May Exacerbate Stress and Anxiety during COVID-19 Endemic,,WA,
2021-11-03,014-001-095-043-059,014-001-095-043,59,Data on Reported Bullying Incidents in Primary and Secondary Schools in 2019 and 2020 and Plans to Facilitate Reporting of Bullying Cases,,WA,
2021-11-03,014-001-095-043-060,014-001-095-043,60,Support for Primary and Secondary School Students who Suffer Bereavement from Death of Parent,,WA,
2021-11-03,014-001-095-043-061,014-001-095-043,61,Breakdown on Calls Reporting Cases of Violence through 24-hour National Anti-Violence Helpline by Demographics,,WA,
2021-11-03,014-001-095-043-062,014-001-095-043,62,Update and Data on Subsidised Hawker Meals Provided to Recipients of Public Assistance Scheme through Meal Coupons or Special Grant Card,,WA,
2021-11-03,014-001-095-043-063,014-001-095-043,63,Proposal for MOH and MOE to Co-curate Mental Health-related Modules in Institutes of Higher Learning,,WA,
2021-11-03,014-001-095-043-064,014-001-095-043,64,"Average Number of Monthly Resignations of Foreign Medical Professionals in 2019, 2020 and 2021 and Impact on Medical System to Cope with Surge in COVID-19 Cases",,WA,
2021-11-03,014-001-095-043-065,014-001-095-043,65,Proposal to Work with Primary Care Network to Establish Appropriate Programmes for Frail and Pre-frail Seniors and Scaling up Healthy Ageing Promotion Programme for You,,WA,
2021-11-03,014-001-095-043-066,014-001-095-043,66,"Breakdown of Number of Declarations, Directives, Orders and Notices Issued under Protection from Online Falsehoods and Manipulation Act to-date by Ministries",,WA,
2021-11-03,014-001-095-043-067,014-001-095-043,67,"Outcome of Applications Received by POFMA Office for Variations, Cancellations or Suspensions of Directions or Remedial Orders Issued",,WA,
2021-11-03,014-001-095-043-068,014-001-095-043,68,"Availability of Studies on Whether Pandemic Vulnerability is Shaped by Urban Design, Demographics and Movements of Residents",,WA,
2021-11-03,014-001-095-043-069,014-001-095-043,69,Singapore's Source Countries for Sand Imports and Estimated Size of Sand Smuggling Market,,WA,
2021-11-03,014-001-095-043-070,014-001-095-043,70,Criteria for Locating Coffee Shops or Eateries within an HDB Estate,,WA,
2021-11-03,014-001-095-043-071,014-001-095-043,71,Measures in Place to Identify Isolated Youths Who Spend Significant Portion of Their Time at Home and Schemes to Reach Out,,WA,
2021-11-03,014-001-095-043-072,014-001-095-043,72,Statistics on Number of Days Worker is Repatriated Following Cancellation of Worker's Work Permit,,WA,
2021-11-03,014-001-095-043-073,014-001-095-043,73,Cases of Wrongful Dismissal Lodged by Work Permit Holders in Past Five Years,,WA,
2021-11-03,014-001-095-043-074,014-001-095-043,74,Available Data on Employer Type and Market Salaries for Existing Pool of Migrant Domestic Workers in Light of Restrictions on Entry of New Migrant Domestic Workers,,WA,
2021-11-03,014-001-095-043-075,014-001-095-043,75,Efforts to Encourage Companies to Send Their Professionals for Training on Mental Health Competencies,,WA,
