Date,Topic_CID,Sitting_CID,Order,Title,Subtitle,Section_Type,Question_Count
2022-09-12,014-001-095-067-001,014-001-095-067,1,Tribute to Her Late Majesty Queen Elizabeth II,,OS,
2022-09-12,014-001-095-067-002,014-001-095-067,2,Benefits of New Overseas Networks and Expertise Pass to Singapore and Singaporeans,,OA,
2022-09-12,014-001-095-067-003,014-001-095-067,3,Assessing Cases based on Hoarding Management Framework,,OA,
2022-09-12,014-001-095-067-004,014-001-095-067,4,Review of Fire Safety Standards for HDB Blocks and Installation of Home Fire Alarm Devices for all HDB Public Rental Flats,,OA,
2022-09-12,014-001-095-067-005,014-001-095-067,5,Measures to Improve Work-Life Balance Amongst Teachers,,OA,
2022-09-12,014-001-095-067-006,014-001-095-067,6,Probe into Network Hardware Issues that Caused System Outage at Polyclinics on 27 August 2022 ,,OA,
2022-09-12,014-001-095-067-007,014-001-095-067,7,Data on Nurses' Shift Rosters in General and Intensive Care Wards,,OA,
2022-09-12,014-001-095-067-008,014-001-095-067,8,Proposal to Defer GST Increase Given Increased Tax Collection in FY2021/2022 and Below-inflation Income Growth,,OA,
2022-09-12,014-001-095-067-009,014-001-095-067,9,Prohibiting those Convicted of Sexual Offences and Violent Crimes from Practising as Educators or Tutors,,OA,
2022-09-12,014-001-095-067-010,014-001-095-067,10,"Wait Times for Childcare and Infant Care Places, and Strategies for Ramping Up Capacity when Needed",,OA,
2022-09-12,014-001-095-067-011,014-001-095-067,11,Strengthening Singapore’s Position as a Global Hub for Talent,Statement by Minister for Manpower,OS,
2022-09-12,014-001-095-067-012,014-001-095-067,12,Personal Explanation,,OS,
2022-09-12,014-001-095-067-013,014-001-095-067,13,Business Trusts (Amendment) Bill,,BI,
2022-09-12,014-001-095-067-014,014-001-095-067,14,Income Tax (Amendment) Bill,,BI,
2022-09-12,014-001-095-067-015,014-001-095-067,15,Statutes (Miscellaneous Amendments) Bill,,BI,
2022-09-12,014-001-095-067-016,014-001-095-067,16,Accountants (Amendment) Bill,,BI,
2022-09-12,014-001-095-067-017,014-001-095-067,17,Registration of Criminals (Amendment) Bill,,BP,
2022-09-12,014-001-095-067-018,014-001-095-067,18,Exempted Business,Business Motion,OS,
2022-09-12,014-001-095-067-019,014-001-095-067,19,Singapore Tourism Board (Amendment) Bill,,BP,
2022-09-12,014-001-095-067-020,014-001-095-067,20,Adjournment,,OS,
2022-09-12,014-001-095-067-021,014-001-095-067,21,Appreciating and Supporting the Well-being of Educators in Singapore,,OS,
2022-09-12,014-001-095-067-022,014-001-095-067,22,Curbs on Bulk Purchases of Units within A Single Property Development,,WANA,
2022-09-12,014-001-095-067-023,014-001-095-067,23,Flow of Foreign Money into Local Property Market in Last Two Years,,WANA,
2022-09-12,014-001-095-067-024,014-001-095-067,24,Proposal for Unused SkillsFuture Credits to be Donated to A Pool for Sharing,,WANA,
2022-09-12,014-001-095-067-025,014-001-095-067,25,Measures to Protect Our Young In View of Rise of Metaverse and Number of Gaming Platforms,,WANA,
2022-09-12,014-001-095-067-026,014-001-095-067,26,Plans to Mitigate Risk of Severe Transboundary Haze,,WANA,
2022-09-12,014-001-095-067-027,014-001-095-067,27,Vaccination for Individuals at Higher Risk of Catching Monkeypox,,WANA,
2022-09-12,014-001-095-067-028,014-001-095-067,28,Recognition of Caregivers' Contributions and Government's Care for Their Well-being,,WANA,
2022-09-12,014-001-095-067-029,014-001-095-067,29,Care Options Within Community to Give Respite to Caregivers,,WANA,
2022-09-12,014-001-095-067-030,014-001-095-067,30,Care Options for Adults with Developmental Disabilities Accompanied by Serious Psychotic or Behavioural Problems,,WANA,
2022-09-12,014-001-095-067-031,014-001-095-067,31,Impact of Change of Singapore Sports Hub Ownership and Management on Access to Facilities and Government Funding,,WANA,
2022-09-12,014-001-095-067-032,014-001-095-067,32,Temporary Extension of Stay for HDB Flat Owners to Rectify Non-compliant Structures within Flat in Resale Transactions,,WANA,
2022-09-12,014-001-095-067-033,014-001-095-067,33,Increasing Capacity of Primary Schools in MacPherson to Cater to New Residences Built,,WANA,
2022-09-12,014-001-095-067-034,014-001-095-067,34,Appeals for Children's Admission to Primary Schools Near Residences,,WANA,
2022-09-12,014-001-095-067-035,014-001-095-067,35,Detection and Prevention of Abuse of Controlled Substances in Military Installations,,WANA,
2022-09-12,014-001-095-067-036,014-001-095-067,36,Cases of Singaporean Travellers Buying Products with Cannabis in Thailand,,WANA,
2022-09-12,014-001-095-067-037,014-001-095-067,37,Inclusion of Service Quality of Public Transport Operators in Fare Review Formula,,WANA,
2022-09-12,014-001-095-067-038,014-001-095-067,38,Expediting Release of Approved Code of Practice for Company Directors’ Workplace Safety and Health Duties,,WANA,
2022-09-12,014-001-095-067-039,014-001-095-067,39,Excessive Risk-taking by Gig and Platform Workers to Fulfil Orders,,WANA,
2022-09-12,014-001-095-067-040,014-001-095-067,40,Guidelines on Rest Hours for Public and Private Bus Drivers,,WANA,
2022-09-12,014-001-095-067-041,014-001-095-067,41,Review of Income Eligibility Criteria for Monthly School Bus Subsidies for Primary School Students,,WANA,
2022-09-12,014-001-095-067-042,014-001-095-067,42,"Update on Collection, Filtration, Testing and Delivery Procedures for Drinking Water in Singapore",,WANA,
2022-09-12,014-001-095-067-043,014-001-095-067,43,Laboratory-grown Food Options as Significant Component of Food Security in Singapore,,WANA,
2022-09-12,014-001-095-067-044,014-001-095-067,44,Aligning Maximum Payable Amounts in Contract of Employment for Winding-up across Legislation,,WANA,
2022-09-12,014-001-095-067-045,014-001-095-067,45,"Operating Revenue, Expenditures and Overall Surplus or Deficit of Current Government",,WANA,
2022-09-12,014-001-095-067-046,014-001-095-067,46,Advance Announcements for HDB Precincts Selected for Home Improvement Programme,,WANA,
2022-09-12,014-001-095-067-047,014-001-095-067,47,Rezoning Land along Fernvale Close and Fernvale Link,,WANA,
2022-09-12,014-001-095-067-048,014-001-095-067,48,Lowering Qualifying Age for Lease Buyback Scheme in Special Cases,,WANA,
2022-09-12,014-001-095-067-049,014-001-095-067,49,Energy-efficient Accreditation of Commercial Equipment and Plans to Expand Scale of Accreditation for SMEs,,WANA,
2022-09-12,014-001-095-067-050,014-001-095-067,50,Measures to Cope with Drought in Singapore,,WANA,
2022-09-12,014-001-095-067-051,014-001-095-067,51,Effectiveness of Singapore’s Single-stream Recycling Approach,,WANA,
2022-09-12,014-001-095-067-052,014-001-095-067,52,Timeline on Rollout of SG Mental Well-Being Network Programme,,WANA,
2022-09-12,014-001-095-067-053,014-001-095-067,53,Removal of Quota for Each Grade under Performance Management System for Teachers,,WANA,
2022-09-12,014-001-095-067-054,014-001-095-067,54,Measures to Protect School Staff from Abuse by Parents and Students,,WANA,
2022-09-12,014-001-095-067-055,014-001-095-067,55,Encouraging More to Join Social Service and Disability Care Sector,,WANA,
2022-09-12,014-001-095-067-056,014-001-095-067,56,Impact of Strengthening Sing Dollar on Plans to Rejuvenate Tourism and MICE Sectors,,WANA,
2022-09-12,014-001-095-067-057,014-001-095-067,57,Impact of Inflation on Singapore Companies' Product and Service Competitiveness and Productivity,,WANA,
2022-09-12,014-001-095-067-058,014-001-095-067,58,Allowing Parents to Use Cash to Pay for Children’s MediShield Life Plan Premiums,,WANA,
2022-09-12,014-001-095-067-059,014-001-095-067,59,Review of LumiHealth Programme,,WANA,
2022-09-12,014-001-095-067-060,014-001-095-067,60,Offering Deferment of Human Papillomavirus Vaccination to Female Students Beyond Secondary 2,,WANA,
2022-09-12,014-001-095-067-061,014-001-095-067,61,Bullying Cases Reported in Primary and Secondary Schools in Past Three Years,,WANA,
2022-09-12,014-001-095-067-062,014-001-095-067,62,Review of Curricula in Institutes of Higher Learning,,WANA,
2022-09-12,014-001-095-067-063,014-001-095-067,63,Matching Salary Increments for Early Childhood Educators to Those for MOE Kindergarten Teachers,,WANA,
2022-09-12,014-001-095-067-064,014-001-095-067,64,Fines on Bunkering Companies Found to be Non-compliant with Fuel Assurance Standards,,WANA,
2022-09-12,014-001-095-067-065,014-001-095-067,65,Impact of Measures to Encourage Prudent Bidding of COEs for Motorcycles,,WANA,
2022-09-12,014-001-095-067-066,014-001-095-067,66,Impact of Geopolitical Tensions on SAF's Overseas Training Exercises,,WANA,
2022-09-12,014-001-095-067-067,014-001-095-067,67,"Reasons for Listing GCE ""O"" Level Grades in Singpass App",,WANA,
2022-09-12,014-001-095-067-068,014-001-095-067,68,Observations with Resumption of National School Games This Year,,WANA,
2022-09-12,014-001-095-067-069,014-001-095-067,69,Students on Overseas Attachments in Post-COVID-19 Landscape and When Smoking of Cannabis is Legalised in Some Countries,,WANA,
2022-09-12,014-001-095-067-070,014-001-095-067,70,"Number of Traffic Offences, Licence Suspensions and Safety Retrainings amongst Private Hire Platform Drivers",,WANA,
2022-09-12,014-001-095-067-071,014-001-095-067,71,Applications for Permanent Residency and Citizenship for Spouses and Relatives of Singapore Citizens,,WANA,
2022-09-12,014-001-095-067-072,014-001-095-067,72,Repatriation Costs for Foreign Domestic Workers and Work Permit Holders Who Leave after First Month of Employment,,WANA,
2022-09-12,014-001-095-067-073,014-001-095-067,73,Unintended Consequences from Legislating Right to Work from Home,,WANA,
2022-09-12,014-001-095-067-074,014-001-095-067,74,Green Cover Target and Pans to Intensify Greenery Density in Singapore,,WANA,
2022-09-12,014-001-095-067-075,014-001-095-067,75,More Comprehensive Insurance Coverage for HDB Homes,,WANA,
2022-09-12,014-001-095-067-076,014-001-095-067,76,"Prices of Cooked Food Sold in Mature Estates, Non-mature Estates, Older Coffee Shops and Newer Coffee Shops",,WANA,
2022-09-12,014-001-095-067-077,014-001-095-067,77,"Update on ""Buy Now Pay Later"" Loans",,WA,
2022-09-12,014-001-095-067-078,014-001-095-067,78,Effects of Increasing Childcare Leave on a Person's Employability,,WA,
2022-09-12,014-001-095-067-079,014-001-095-067,79,Limits on Borrowing Costs for Secured and Unsecured Lending to Consumers,,WA,
2022-09-12,014-001-095-067-080,014-001-095-067,80,Public's Retail Exposure to Licensed Digital Payment Token Service Providers,,WA,
2022-09-12,014-001-095-067-081,014-001-095-067,81,Raising Tax Relief Claimable under Working Mother's Child Relief Scheme,,WA,
2022-09-12,014-001-095-067-082,014-001-095-067,82,Annual Amount of Subsidies and Other Support Provided to Businesses in Past Three Years,,WA,
2022-09-12,014-001-095-067-083,014-001-095-067,83,Eligibility for and Issues with NS55 Recognition Package,,WA,
2022-09-12,014-001-095-067-084,014-001-095-067,84,Foreign Students' Applications to Study at Local Private School in Past Five Years,,WA,
2022-09-12,014-001-095-067-085,014-001-095-067,85,Fires in HDB Units Caused by Cluttered Homes in Last 10 Years,,WA,
2022-09-12,014-001-095-067-086,014-001-095-067,86,Reinstating Parents' Dialect Group in Child's Birth Certificate,,WA,
2022-09-12,014-001-095-067-087,014-001-095-067,87,Parts 4 to 7 of Foreign Interference Countermeasures Act,,WA,
2022-09-12,014-001-095-067-088,014-001-095-067,88,Inclusion of Name of Stillborn Child in New Digital Birth Certificates,,WA,
2022-09-12,014-001-095-067-089,014-001-095-067,89,Enhancing Transaction Safety on Social Media and E-commerce Platforms,,WA,
2022-09-12,014-001-095-067-090,014-001-095-067,90,Enhancing Penalties for Drink Driving Offences,,WA,
2022-09-12,014-001-095-067-091,014-001-095-067,91,Effect of Pandemic on Singapore's Nominal Wage Growth and Nominal National Productivity,,WA,
2022-09-12,014-001-095-067-092,014-001-095-067,92,Retail Properties Owned by Government and Government- and Temasek-linked Entities and Companies,,WA,
2022-09-12,014-001-095-067-093,014-001-095-067,93,Position on Deep Seabed Mining and Cost and Benefit of Moratorium on Such Activities,,WA,
2022-09-12,014-001-095-067-094,014-001-095-067,94,Number of EntrePasses and Tech.Passes Issued to Foreign PMEs Since Introduction,,WA,
2022-09-12,014-001-095-067-095,014-001-095-067,95,Number of Singaporean PMEs Placed on Global Ready Talent Programme Since Establishment,,WA,
2022-09-12,014-001-095-067-096,014-001-095-067,96,Tech.Pass Applications Received and Approved and Their Median and Mean Monthly Salaries,,WA,
2022-09-12,014-001-095-067-097,014-001-095-067,97,Pro-Enterprise Panel's Help to Businesses in Singapore,,WA,
2022-09-12,014-001-095-067-098,014-001-095-067,98,Effect of US' CHIPS and Science Act on Singapore's Semiconductor Manufacturing Industry,,WA,
2022-09-12,014-001-095-067-099,014-001-095-067,99,Measures to Reduce COE Price Volatility and Encourage Switch to Electric Vehicles,,WA,
2022-09-12,014-001-095-067-100,014-001-095-067,100,Erection of Noise Barrier from Bukit Batok MRT Station to Tunnel in Direction of Bukit Gombak,,WA,
2022-09-12,014-001-095-067-101,014-001-095-067,101,Need for Taxi Commuters to Wear Masks to Protect Older Taxi Drivers,,WA,
2022-09-12,014-001-095-067-102,014-001-095-067,102,Effect of US' Inflation Reduction Act on Singapore Green Plan 2030,,WA,
2022-09-12,014-001-095-067-103,014-001-095-067,103,Enforcement Actions Against Table Littering at Public Dining Spaces Since Implementation,,WA,
2022-09-12,014-001-095-067-104,014-001-095-067,104,Impact of Improper Disposal of Fishing Gear on Oceans and Marine Life,,WA,
2022-09-12,014-001-095-067-105,014-001-095-067,105,Changes to Primary 1 Registration Framework in Reducing Number of Schools Requiring Balloting,,WA,
2022-09-12,014-001-095-067-106,014-001-095-067,106,Oversubscription of Primary 1 Places at Princess Elizabeth Primary School,,WA,
2022-09-12,014-001-095-067-107,014-001-095-067,107,Full-fee Paying vs Tuition Grant-receiving Non-Singaporean Students in Government-funded Autonomous Universities,,WA,
2022-09-12,014-001-095-067-108,014-001-095-067,108,Steps Taken to Ensure Affordability of Food Sold in School Canteens,,WA,
2022-09-12,014-001-095-067-109,014-001-095-067,109,Outcome of Investigations by Office of Public Guardian under Mental Capacity Act,,WA,
2022-09-12,014-001-095-067-110,014-001-095-067,110,Update on Review of ComCare Eligibility Criteria,,WA,
2022-09-12,014-001-095-067-111,014-001-095-067,111,Training of Staff Manning Suicide Counselling Hotlines in Handling Cases Involving Children,,WA,
2022-09-12,014-001-095-067-112,014-001-095-067,112,Measures to Ensure Supply Chain Resilience for Over-the-counter Medication in Retail Pharmacies,,WA,
2022-09-12,014-001-095-067-113,014-001-095-067,113,Payment of Claims by Integrated Shield Plan Policyholders for Care at Healthcare Institutions,,WA,
2022-09-12,014-001-095-067-114,014-001-095-067,114,Number of Fitness Activities and Participants Registered at Residents Network Clusters,,WA,
2022-09-12,014-001-095-067-115,014-001-095-067,115,Patients Treated at Specialist Clinics in Restructured Hospitals for Diabetes Mellitus,,WA,
2022-09-12,014-001-095-067-116,014-001-095-067,116,Ensuring Competitiveness of Local Remunerations for Qualified Registered Nurses,,WA,
2022-09-12,014-001-095-067-117,014-001-095-067,117,Immediate Crisis Mental Health Care Support Sought Between 2019 and 2021 and Qualified Professionals Available,,WA,
2022-09-12,014-001-095-067-118,014-001-095-067,118,Tenants of HDB Rental Flats in Arrears in First Six Months of 2022,,WA,
2022-09-12,014-001-095-067-119,014-001-095-067,119,More Loading/Unloading Parking Lots in HDB and Private Estates to Facilitate Deliveries to Residents,,WA,
2022-09-12,014-001-095-067-120,014-001-095-067,120,Reasons Commercial and Institutional Building Owners Not Tapping On Accessibility Fund for Barrier-free Access,,WA,
2022-09-12,014-001-095-067-121,014-001-095-067,121,Actions Against Non-compliance with Progressive Wage Model for Lift and Escalator Technicians,,WA,
2022-09-12,014-001-095-067-122,014-001-095-067,122,HDB Flats Damaged by Fire and Households Covered under HDB Fire Insurance Scheme,,WA,
2022-09-12,014-001-095-067-123,014-001-095-067,123,Regulations on Hoarding as Fire Hazard in Residential Estates,,WA,
2022-09-12,014-001-095-067-124,014-001-095-067,124,Measures to Ensure New Buildings and Estates are Designed for Easier Maintenance to Minimise Mosquito Breeding,,WA,
2022-09-12,014-001-095-067-125,014-001-095-067,125,Waiting Times for HDB Rental Flat Allocations under Public Rental Scheme,,WA,
2022-09-12,014-001-095-067-126,014-001-095-067,126,Number of Undisclosed HDB Flat Subletting Cases Found Between 2010 and 2021,,WA,
2022-09-12,014-001-095-067-127,014-001-095-067,127,Eligibility of Single Parents with Interim Judgment of Divorce for Subsidised Flat under Assistance Scheme for Second-Timers and Parenthood Provisional Housing Scheme,,WA,
2022-09-12,014-001-095-067-128,014-001-095-067,128,Steps to Ensure SG Mental Well-Being Network Workers are Equipped to Assist Persons Coping with Mental Health,,WA,
2022-09-12,014-001-095-067-129,014-001-095-067,129,Impact of Inflation on Workers and Provision of Appropriate Wage Increments,,WA,
2022-09-12,014-001-095-067-130,014-001-095-067,130,Plans to Raise Local Qualifying Salary to Benefit Lower-wage Earners,,WA,
2022-09-12,014-001-095-067-131,014-001-095-067,131,Sectors Facing Severe Lack of Workers and Measures to Support Manpower Needs,,WA,
2022-09-12,014-001-095-067-132,014-001-095-067,132,Employers Prosecuted for Inflating Foreign Worker Quota by Employing Singaporean Phantom Workers,,WA,
2022-09-12,014-001-095-067-133,014-001-095-067,133,"Singaporeans Employed by Multiple Companies at Less than $1,500 at Each Company for Headcount",,WA,
2022-09-12,014-001-095-067-134,014-001-095-067,134,Action Against Migrant Domestic Workers Borrowing Money from Illegal Loan Sharks,,WA,
2022-09-12,014-001-095-067-135,014-001-095-067,135,Data on Average Monthly Salary Drawn by Employment Pass Holders,,WA,
2022-09-12,014-001-095-067-136,014-001-095-067,136,Clarification by Leader of the House,,WS,
