Date,Sitting_CID,MP_Name,Attendance
2022-11-28,014-001-095-076,Mr Chong Kee Hiong (Bishan-Toa Payoh).,False
2022-11-28,014-001-095-076,Mr Desmond Choo (Tampines).,False
2022-11-28,014-001-095-076,Mr Chua Kheng Wee Louis (Sengkang).,False
2022-11-28,014-001-095-076,Ms He Ting Ru (Sengkang).,False
2022-11-28,014-001-095-076,Prof Koh Lian Pin (Nominated Member).,False
2022-11-28,014-001-095-076,"Dr Mohamad Maliki Bin Osman (East Coast), Minister, Prime Minister's Office and Second Minister for Education and Foreign Affairs.",False
2022-11-28,014-001-095-076,Mr Muhamad Faisal Bin Abdul Manap (Aljunied).,False
2022-11-28,014-001-095-076,Ms Poh Li San (Sembawang).,False
2022-11-28,014-001-095-076,Mr Raj Joshua Thomas (Nominated Member).,False
2022-11-28,014-001-095-076,"Mr Edwin Tong Chun Fai (Marine Parade), Minister for Culture, Community and Youth and Second Minister for Law.",False
2022-11-28,014-001-095-076,Mr Yip Hon Weng (Yio Chu Kang).,False
2022-11-28,014-001-095-076,"Mr Zaqy Mohamad (Marsiling-Yew Tee), Senior Minister of State for Defence and Manpower and Deputy Leader of the House.",False
2022-11-28,014-001-095-076,Mr SPEAKER (Mr Tan Chuan-Jin (Marine Parade)). ,True
2022-11-28,014-001-095-076,Mr Abdul Samad (Nominated Member). ,True
2022-11-28,014-001-095-076,Ms Janet Ang (Nominated Member). ,True
2022-11-28,014-001-095-076,Mr Ang Wei Neng (West Coast). ,True
2022-11-28,014-001-095-076,"Mr Baey Yam Keng (Tampines), Senior Parliamentary Secretary to the Minister for Sustainability and the Environment and Minister for Transport. ",True
2022-11-28,014-001-095-076,"Mr Chan Chun Sing (Tanjong Pagar), Minister for Education. ",True
2022-11-28,014-001-095-076,Miss Cheryl Chan Wei Ling (East Coast). ,True
2022-11-28,014-001-095-076,Mr Mark Chay (Nominated Member). ,True
2022-11-28,014-001-095-076,"Mr Chee Hong Tat (Bishan-Toa Payoh), Senior Minister of State for Finance and Transport. ",True
2022-11-28,014-001-095-076,Mr Cheng Hsing Yao (Nominated Member). ,True
2022-11-28,014-001-095-076,Miss Cheng Li Hui (Tampines). ,True
2022-11-28,014-001-095-076,Mr Edward Chia Bing Hui (Holland-Bukit Timah). ,True
2022-11-28,014-001-095-076,"Mr Eric Chua (Tanjong Pagar), Senior Parliamentary Secretary to the Minister for Culture, Community and Youth and Minister for Social and Family Development. ",True
2022-11-28,014-001-095-076,Mr Darryl David (Ang Mo Kio). ,True
2022-11-28,014-001-095-076,"Mr Christopher de Souza (Holland-Bukit Timah), Deputy Speaker. ",True
2022-11-28,014-001-095-076,Ms Foo Mee Har (West Coast). ,True
2022-11-28,014-001-095-076,"Ms Grace Fu Hai Yien (Yuhua), Minister for Sustainability and the Environment. ",True
2022-11-28,014-001-095-076,"Mr Gan Kim Yong (Chua Chu Kang), Minister for Trade and Industry. ",True
2022-11-28,014-001-095-076,"Ms Gan Siow Huang (Marymount), Minister of State for Education and Manpower. ",True
2022-11-28,014-001-095-076,Mr Gan Thiam Poh (Ang Mo Kio). ,True
2022-11-28,014-001-095-076,Mr Gerald Giam Yean Song (Aljunied). ,True
2022-11-28,014-001-095-076,Mr Derrick Goh (Nee Soon). ,True
2022-11-28,014-001-095-076,"Mr Heng Chee How (Jalan Besar), Senior Minister of State for Defence. ",True
2022-11-28,014-001-095-076,"Mr Heng Swee Keat (East Coast), Deputy Prime Minister and Coordinating Minister for Economic Policies. ",True
2022-11-28,014-001-095-076,Prof Hoon Hian Teck (Nominated Member). ,True
2022-11-28,014-001-095-076,Mr Shawn Huang Wei Zhong (Jurong). ,True
2022-11-28,014-001-095-076,"Ms Indranee Rajah (Tanjong Pagar), Minister, Prime Minister's Office and Second Minister for Finance and National Development and Leader of the House. ",True
2022-11-28,014-001-095-076,"Mr S Iswaran (West Coast), Minister for Transport and Minister-in-charge of Trade Relations. ",True
2022-11-28,014-001-095-076,"Dr Janil Puthucheary (Pasir Ris-Punggol), Senior Minister of State for Communications and Information and Health and Government Whip. ",True
2022-11-28,014-001-095-076,"Dr Amy Khor Lean Suan (Hong Kah North), Senior Minister of State for Sustainability and the Environment and Transport. ",True
2022-11-28,014-001-095-076,"Dr Koh Poh Koon (Tampines), Senior Minister of State for Manpower and Sustainability and the Environment. ",True
2022-11-28,014-001-095-076,Mr Kwek Hian Chuan Henry (Kebun Baru). ,True
2022-11-28,014-001-095-076,"Mr Desmond Lee (West Coast), Minister for National Development, Minister-in-charge of Social Services Integration. ",True
2022-11-28,014-001-095-076,"Mr Lee Hsien Loong (Ang Mo Kio), Prime Minister. ",True
2022-11-28,014-001-095-076,Mr Leong Mun Wai (Non-Constituency Member). ,True
2022-11-28,014-001-095-076,Mr Liang Eng Hwa (Bukit Panjang). ,True
2022-11-28,014-001-095-076,Mr Lim Biow Chuan (Mountbatten). ,True
2022-11-28,014-001-095-076,Assoc Prof Jamus Jerome Lim (Sengkang). ,True
2022-11-28,014-001-095-076,Ms Sylvia Lim (Aljunied). ,True
2022-11-28,014-001-095-076,Dr Lim Wee Kiak (Sembawang). ,True
2022-11-28,014-001-095-076,"Ms Low Yen Ling (Chua Chu Kang), Minister of State for Culture, Community and Youth and Trade and Industry. ",True
2022-11-28,014-001-095-076,Ms Mariam Jaafar (Sembawang). ,True
2022-11-28,014-001-095-076,"Mr Masagos Zulkifli B M M (Tampines), Minister for Social and Family Development, Second Minister for Health and Minister-in-charge of Muslim Affairs. ",True
2022-11-28,014-001-095-076,Mr Mohd Fahmi Aliman (Marine Parade). ,True
2022-11-28,014-001-095-076,"Assoc Prof Dr Muhammad Faishal Ibrahim (Nee Soon), Minister of State for Home Affairs and National Development. ",True
2022-11-28,014-001-095-076,Mr Murali Pillai (Bukit Batok). ,True
2022-11-28,014-001-095-076,Ms Nadia Ahmad Samdin (Ang Mo Kio). ,True
2022-11-28,014-001-095-076,"Dr Ng Eng Hen (Bishan-Toa Payoh), Minister for Defence. ",True
2022-11-28,014-001-095-076,Mr Louis Ng Kok Kwang (Nee Soon). ,True
2022-11-28,014-001-095-076,Ms Ng Ling Ling (Ang Mo Kio). ,True
2022-11-28,014-001-095-076,Miss Rachel Ong (West Coast). ,True
2022-11-28,014-001-095-076,"Mr Ong Ye Kung (Sembawang), Minister for Health. ",True
2022-11-28,014-001-095-076,Ms Joan Pereira (Tanjong Pagar). ,True
2022-11-28,014-001-095-076,Mr Leon Perera (Aljunied). ,True
2022-11-28,014-001-095-076,Ms Denise Phua Lay Peng (Jalan Besar). ,True
2022-11-28,014-001-095-076,Ms Hazel Poa (Non-Constituency Member). ,True
2022-11-28,014-001-095-076,"Mr Pritam Singh (Aljunied), Leader of the Opposition. ",True
2022-11-28,014-001-095-076,"Ms Rahayu Mahzam (Jurong), Senior Parliamentary Secretary to the Minister for Health and Minister for Law. ",True
2022-11-28,014-001-095-076,Mr Saktiandi Supaat (Bishan-Toa Payoh). ,True
2022-11-28,014-001-095-076,Mr Seah Kian Peng (Marine Parade). ,True
2022-11-28,014-001-095-076,Dr Shahira Abdullah (Nominated Member). ,True
2022-11-28,014-001-095-076,"Mr K Shanmugam (Nee Soon), Minister for Home Affairs and Law. ",True
2022-11-28,014-001-095-076,Mr Sharael Taha (Pasir Ris-Punggol). ,True
2022-11-28,014-001-095-076,"Ms Sim Ann (Holland-Bukit Timah), Senior Minister of State for Foreign Affairs and National Development and Deputy Government Whip. ",True
2022-11-28,014-001-095-076,Mr Sitoh Yih Pin (Potong Pasir). ,True
2022-11-28,014-001-095-076,Ms Hany Soh (Marsiling-Yew Tee). ,True
2022-11-28,014-001-095-076,"Ms Sun Xueling (Punggol West), Minister of State for Home Affairs and Social and Family Development. ",True
2022-11-28,014-001-095-076,"Mr Alvin Tan (Tanjong Pagar), Minister of State for Culture, Community and Youth and Trade and Industry. ",True
2022-11-28,014-001-095-076,Ms Carrie Tan (Nee Soon). ,True
2022-11-28,014-001-095-076,"Mr Desmond Tan (Pasir Ris-Punggol), Minister of State, Prime Minister's Office. ",True
2022-11-28,014-001-095-076,"Mr Tan Kiat How (East Coast), Senior Minister of State for Communications and Information and National Development. ",True
2022-11-28,014-001-095-076,Mr Dennis Tan Lip Fong (Hougang). ,True
2022-11-28,014-001-095-076,"Dr Tan See Leng (Marine Parade), Minister for Manpower and Second Minister for Trade and Industry. ",True
2022-11-28,014-001-095-076,"Ms Jessica Tan Soon Neo (East Coast), Deputy Speaker. ",True
2022-11-28,014-001-095-076,Dr Tan Wu Meng (Jurong). ,True
2022-11-28,014-001-095-076,Dr Tan Yia Swam (Nominated Member). ,True
2022-11-28,014-001-095-076,Mr Patrick Tay Teck Guan (Pioneer). ,True
2022-11-28,014-001-095-076,"Mr Teo Chee Hean (Pasir Ris-Punggol), Senior Minister and Coordinating Minister for National Security. ",True
2022-11-28,014-001-095-076,"Mrs Josephine Teo (Jalan Besar), Minister for Communications and Information and Second Minister for Home Affairs. ",True
2022-11-28,014-001-095-076,"Mr Tharman Shanmugaratnam (Jurong), Senior Minister and Coordinating Minister for Social Policies. ",True
2022-11-28,014-001-095-076,Ms Tin Pei Ling (MacPherson). ,True
2022-11-28,014-001-095-076,Mr Vikram Nair (Sembawang). ,True
2022-11-28,014-001-095-076,"Dr Vivian Balakrishnan (Holland-Bukit Timah), Minister for Foreign Affairs. ",True
2022-11-28,014-001-095-076,Dr Wan Rizal (Jalan Besar). ,True
2022-11-28,014-001-095-076,Mr Don Wee (Chua Chu Kang). ,True
2022-11-28,014-001-095-076,"Mr Lawrence Wong (Marsiling-Yew Tee), Deputy Prime Minister and Minister for Finance. ",True
2022-11-28,014-001-095-076,Mr Xie Yao Quan (Jurong). ,True
2022-11-28,014-001-095-076,Mr Alex Yam (Marsiling-Yew Tee). ,True
2022-11-28,014-001-095-076,Ms Yeo Wan Ling (Pasir Ris-Punggol). ,True
2022-11-28,014-001-095-076,Mr Melvin Yong Yik Chye (Radin Mas). ,True
2022-11-28,014-001-095-076,Mr Zhulkarnain Abdul Rahim (Chua Chu Kang). ,True
