Date,Topic_CID,Sitting_CID,Order,Title,Subtitle,Section_Type,Question_Count
2023-04-18,014-002-095-098-001,014-002-095-098,1,Statement by Leader of the House,,OS,
2023-04-18,014-002-095-098-002,014-002-095-098,2,"Corruption, Drug Trafficking and Other Serious Crimes (Confiscation of Benefits) (Amendment) Bill",,BI,
2023-04-18,014-002-095-098-003,014-002-095-098,3,Computer Misuse (Amendment) Bill,,BI,
2023-04-18,014-002-095-098-004,014-002-095-098,4,"Companies, Business Trusts and Other Bodies (Miscellaneous Amendments) Bill",,BI,
2023-04-18,014-002-095-098-005,014-002-095-098,5,Debate on President's Address,Second allotted day,OS,
2023-04-18,014-002-095-098-006,014-002-095-098,6,Adjournment of Debate,,OS,
2023-04-18,014-002-095-098-007,014-002-095-098,7,Adjournment,,OS,
